----------------------------------------------------------------------------
CrystalDiskInfo 8.16.4 (C) 2008-2022 hiyohiyo
                                Crystal Dew World: https://crystalmark.info/
----------------------------------------------------------------------------

    OS : Windows 10  [10.0 Build 19045] (x64)
  Date : 2025/05/12 9:36:19

-- Controller Map ----------------------------------------------------------
 + Standard SATA AHCI Controller [ATA]
   - KINGSTON SA400S37960G
   - ST4000DX001-1CE168
   - Samsung SSD 860 EVO 500GB
   - ST8000DM004-2CX188
 - Microsoft Storage Spaces Controller [SCSI]
 + Standard NVM Express Controller [SCSI]
   - Samsung SSD 980 1TB
 - Xvdd SCSI Miniport [SCSI]

-- Disk List ---------------------------------------------------------------
 (01) ST8000DM004-2CX188 : 8001.5 GB [0/0/0, pd1]
 (02) KINGSTON SA400S37960G : 960.1 GB [1/0/0, pd1] - ki
 (03) ST4000DX001-1CE168 : 4000.7 GB [2/0/0, pd1]
 (04) Samsung SSD 860 EVO 500GB : 500.1 GB [3/0/0, pd1] - sg
 (05) Samsung SSD 980 1TB : 1000.2 GB [4/1/0, sq] - nv

----------------------------------------------------------------------------
 (01) ST8000DM004-2CX188
----------------------------------------------------------------------------
           Model : ST8000DM004-2CX188
        Firmware : 0001
   Serial Number : ZR10DSCB
       Disk Size : 8001.5 GB (8.4/137.4/8001.5/8001.5)
     Buffer Size : Unknown
     Queue Depth : 32
    # of Sectors : 15628053168
   Rotation Rate : 5425 RPM
       Interface : Serial ATA
   Major Version : ACS-3
   Minor Version : ACS-3 Revision 5
   Transfer Mode : SATA/600 | SATA/600
  Power On Hours : 16807 hours
  Power On Count : 410 count
     Temperature : 29 C (84 F)
   Health Status : Bad
        Features : S.M.A.R.T., NCQ
       APM Level : ----
       AAM Level : ----
    Drive Letter : F:

-- S.M.A.R.T. --------------------------------------------------------------
ID Cur Wor Thr RawValues(6) Attribute Name
01 _80 _64 __6 00000573DD85 Read Error Rate
03 _92 _92 __0 000000000000 Spin-Up Time
04 _95 _95 _20 0000000016AF Start/Stop Count
05 __1 __1 _10 00000000F860 Reallocated Sectors Count
07 _80 _60 _45 000005D6DE60 Seek Error Rate
09 _81 _81 __0 04E6000041A7 Power-On Hours
0A 100 100 _97 000000000000 Spin Retry Count
0C 100 100 _20 00000000019A Power Cycle Count
B7 100 100 __0 000000000000 Vendor Specific
B8 100 100 _99 000000000000 End-to-End Error
BB 100 100 __0 000000000000 Reported Uncorrectable Errors
BC 100 _92 __0 004100410043 Command Timeout
BD 100 100 __0 000000000000 High Fly Writes
BE _71 _57 _40 00001D14001D Airflow Temperature
BF 100 100 __0 000000000000 G-Sense Error Rate
C0 100 100 __0 000000000071 Power-off Retract Count
C1 _88 _88 __0 0000000062D7 Load/Unload Cycle Count
C2 _29 _43 __0 000D0000001D Temperature
C3 _80 _64 __0 00000573DD85 Hardware ECC recovered
C5 100 100 __0 000000000000 Current Pending Sector Count
C6 100 100 __0 000000000000 Uncorrectable Sector Count
C7 200 200 __0 000000000000 UltraDMA CRC Error Count
F0 100 253 __0 A7B60000236B Head Flying Hours
F1 100 253 __0 0004BB952A83 Total Host Writes
F2 100 253 __0 0006C7958307 Total Host Reads

-- IDENTIFY_DEVICE ---------------------------------------------------------
        0    1    2    3    4    5    6    7    8    9
000: 0C5A 3FFF C837 0010 0000 0000 003F 0000 0000 0000
010: 2020 2020 2020 2020 2020 2020 5A52 3130 4453 4342
020: 0000 0000 0000 3030 3031 2020 2020 5354 3830 3030
030: 444D 3030 342D 3243 5831 3838 2020 2020 2020 2020
040: 2020 2020 2020 2020 2020 2020 2020 8010 4000 2F00
050: 4000 0200 0200 0007 3FFF 0010 003F FC10 00FB 0110
060: FFFF 0FFF 0000 0007 0003 0078 0078 0078 0078 0100
070: 0000 0000 0000 0000 0000 001F 870E 0006 00CC 0040
080: 07F0 006D 346B 7561 4163 3469 B441 4163 207F 81EE
090: 81EE 0000 FFFE 0000 D0D0 0000 0000 0000 0000 0000
100: 2AB0 A381 0003 0000 0000 0000 6003 0000 5000 C500
110: C8FE 0650 0000 0000 0000 0000 0000 0000 0000 40DE
120: 409C 0000 0000 0000 0000 0000 0000 0000 0029 0000
130: 0000 0000 0000 0000 0000 0000 0000 5000 0000 0000
140: 0000 0000 0000 0000 0000 0000 BDFF 0000 0000 0000
150: 0008 0000 BDFF 0807 0000 8000 0000 0184 9B00 8008
160: 0000 0000 0000 0000 0000 0000 0000 0000 0002 0000
170: 0000 0000 0000 0000 0000 0000 0000 0000 0000 0000
180: 0000 0000 0000 0000 0000 0000 0000 0000 0000 0000
190: 0000 0000 0000 0000 0000 0000 0000 0000 0000 0000
200: 0000 0000 0000 0000 0000 0000 30A5 0000 0000 4000
210: 0000 0000 0000 0000 0000 0000 0000 1531 0000 0000
220: 0000 0000 107F 0000 0000 0000 0000 0000 0000 0000
230: 0000 0000 0000 0000 0000 0000 0000 0000 0000 0000
240: 0000 0000 0000 0000 0000 0000 0000 0000 0000 0000
250: 0000 0000 0000 0000 0000 6CA5

-- SMART_READ_DATA ---------------------------------------------------------
     +0 +1 +2 +3 +4 +5 +6 +7 +8 +9 +A +B +C +D +E +F
000: 0A 00 01 0F 00 50 40 85 DD 73 05 00 00 00 03 03
010: 00 5C 5C 00 00 00 00 00 00 00 04 32 00 5F 5F AF
020: 16 00 00 00 00 00 05 33 00 01 01 60 F8 00 00 00
030: 00 00 07 0F 00 50 3C 60 DE D6 05 00 00 00 09 32
040: 00 51 51 A7 41 00 00 E6 04 21 0A 13 00 64 64 00
050: 00 00 00 00 00 00 0C 32 00 64 64 9A 01 00 00 00
060: 00 00 B7 32 00 64 64 00 00 00 00 00 00 00 B8 32
070: 00 64 64 00 00 00 00 00 00 00 BB 32 00 64 64 00
080: 00 00 00 00 00 00 BC 32 00 64 5C 43 00 41 00 41
090: 00 00 BD 3A 00 64 64 00 00 00 00 00 00 00 BE 22
0A0: 00 47 39 1D 00 14 1D 00 00 00 BF 32 00 64 64 00
0B0: 00 00 00 00 00 00 C0 32 00 64 64 71 00 00 00 00
0C0: 00 00 C1 32 00 58 58 D7 62 00 00 00 00 00 C2 22
0D0: 00 1D 2B 1D 00 00 00 0D 00 00 C3 1A 00 50 40 85
0E0: DD 73 05 00 00 00 C5 12 00 64 64 00 00 00 00 00
0F0: 00 00 C6 10 00 64 64 00 00 00 00 00 00 00 C7 3E
100: 00 C8 C8 00 00 00 00 00 00 00 F0 00 00 64 FD 6B
110: 23 00 00 B6 A7 26 F1 00 00 64 FD 83 2A 95 BB 04
120: 00 00 F2 00 00 64 FD 07 83 95 C7 06 00 00 00 00
130: 00 00 00 00 00 00 00 00 00 00 00 00 00 00 00 00
140: 00 00 00 00 00 00 00 00 00 00 00 00 00 00 00 00
150: 00 00 00 00 00 00 00 00 00 00 00 00 00 00 00 00
160: 00 00 00 00 00 00 00 00 00 00 00 00 00 00 00 73
170: 03 00 01 00 01 FF 02 DA 03 00 00 00 00 00 00 00
180: 00 00 00 00 68 06 00 00 07 08 08 08 08 08 08 08
190: 08 00 00 00 00 00 00 00 00 01 00 00 00 00 00 00
1A0: 00 00 00 00 00 00 00 00 9E B6 A9 02 08 37 00 00
1B0: 00 00 00 00 01 00 06 13 83 2A 95 BB 04 00 00 00
1C0: 07 83 95 C7 06 00 00 00 00 00 00 00 00 00 00 00
1D0: 00 00 00 00 00 00 00 00 35 0E 00 00 01 00 00 00
1E0: 00 00 00 00 FD 00 00 00 00 00 00 00 00 00 03 03
1F0: 00 00 00 00 00 00 00 00 00 00 03 19 00 00 00 93

-- SMART_READ_THRESHOLD ----------------------------------------------------
     +0 +1 +2 +3 +4 +5 +6 +7 +8 +9 +A +B +C +D +E +F
000: 01 00 01 06 00 00 00 00 00 00 00 00 00 00 03 00
010: 00 00 00 00 00 00 00 00 00 00 04 14 00 00 00 00
020: 00 00 00 00 00 00 05 0A 00 00 00 00 00 00 00 00
030: 00 00 07 2D 00 00 00 00 00 00 00 00 00 00 09 00
040: 00 00 00 00 00 00 00 00 00 00 0A 61 00 00 00 00
050: 00 00 00 00 00 00 0C 14 00 00 00 00 00 00 00 00
060: 00 00 B7 00 00 00 00 00 00 00 00 00 00 00 B8 63
070: 00 00 00 00 00 00 00 00 00 00 BB 00 00 00 00 00
080: 00 00 00 00 00 00 BC 00 00 00 00 00 00 00 00 00
090: 00 00 BD 00 00 00 00 00 00 00 00 00 00 00 BE 28
0A0: 00 00 00 00 00 00 00 00 00 00 BF 00 00 00 00 00
0B0: 00 00 00 00 00 00 C0 00 00 00 00 00 00 00 00 00
0C0: 00 00 C1 00 00 00 00 00 00 00 00 00 00 00 C2 00
0D0: 00 00 00 00 00 00 00 00 00 00 C3 00 00 00 00 00
0E0: 00 00 00 00 00 00 C5 00 00 00 00 00 00 00 00 00
0F0: 00 00 C6 00 00 00 00 00 00 00 00 00 00 00 C7 00
100: 00 00 00 00 00 00 00 00 00 00 F0 00 00 00 00 00
110: 00 00 00 00 00 00 F1 00 00 00 00 00 00 00 00 00
120: 00 00 F2 00 00 00 00 00 00 00 00 00 00 00 00 00
130: 00 00 00 00 00 00 00 00 00 00 00 00 00 00 00 00
140: 00 00 00 00 00 00 00 00 00 00 00 00 00 00 00 00
150: 00 00 00 00 00 00 00 00 00 00 00 00 00 00 00 00
160: 00 00 00 00 00 00 00 00 00 00 00 00 00 00 00 00
170: 00 00 00 00 00 00 00 00 00 00 00 00 00 00 00 00
180: 00 00 00 00 00 00 00 00 00 00 00 00 00 00 00 00
190: 00 00 00 00 00 00 00 00 00 00 00 00 00 00 00 00
1A0: 00 00 00 00 00 00 00 00 00 00 00 00 00 00 00 00
1B0: 00 00 00 00 00 00 00 00 00 00 00 00 00 00 00 00
1C0: 00 00 00 00 00 00 00 00 00 00 00 00 00 00 00 00
1D0: 00 00 00 00 00 00 00 00 00 00 00 00 00 00 00 00
1E0: 00 00 00 00 00 00 00 00 00 00 00 00 00 00 00 00
1F0: 00 00 00 00 00 00 00 00 00 00 00 00 00 00 00 30

----------------------------------------------------------------------------
 (02) KINGSTON SA400S37960G
----------------------------------------------------------------------------
           Model : KINGSTON SA400S37960G
        Firmware : SBFKK1B3
   Serial Number : 50026B768344B7A5
       Disk Size : 960.1 GB (8.4/137.4/960.1/960.1)
     Buffer Size : Unknown
     Queue Depth : 32
    # of Sectors : 1875385008
   Rotation Rate : ---- (SSD)
       Interface : Serial ATA
   Major Version : ACS-3
   Minor Version : ACS-3 Revision 4
   Transfer Mode : SATA/600 | SATA/600
  Power On Hours : 28653 hours
  Power On Count : 431 count
      Host Reads : 13055 GB
     Host Writes : 13017 GB
     NAND Writes : 11780 GB
     Temperature : 24 C (75 F)
   Health Status : Good (97 %)
        Features : S.M.A.R.T., APM, NCQ, TRIM
       APM Level : 0000h [OFF]
       AAM Level : ----
    Drive Letter : E:

-- S.M.A.R.T. --------------------------------------------------------------
ID Cur Wor Thr RawValues(6) Attribute Name
01 100 100 __0 000000000000 Uncorrectable Errors
09 100 100 __0 000000006FED Power On Hours
0C 100 100 __0 0000000001AF Power Cycles
94 100 100 __0 000000000000 Vendor Unique
95 100 100 __0 000000000000 Vendor Unique
A7 100 100 __0 000000000000 Vendor Unique
A8 100 100 __0 000000000000 SATA PHY Error Count
A9 100 100 __0 000000000005 Vendor Unique
AA 100 100 _10 00000000000B Bad Block Count
AC 100 100 __0 000000000000 Vendor Unique
AD 100 100 __0 00000016002A Erase Count
B5 100 100 __0 000000000000 Vendor Unique
B6 100 100 __0 000000000000 Vendor Unique
BB 100 100 __0 000000000000 Uncorrectable ECC Errors
C0 100 100 __0 000000000030 Vendor Specific
C2 _24 _53 __0 000C00350018 Temperature
C4 100 100 __0 000000000000 Reallocation Events
C7 100 100 __0 000000000000 SATA CRC Error
DA 100 100 __0 000000000000 CRC Error Count
E7 _97 _97 __0 000000000061 SSD Wear Indicator
E9 100 100 __0 000000002E04 Lifetime Nand Writes
F1 100 100 __0 0000000032D9 Lifetime Writes from Host
F2 100 100 __0 0000000032FF Lifetime Read from Host
F4 100 100 __0 000000000016 Average Erase Count
F5 100 100 __0 00000000002A Max Erase Count
F6 100 100 __0 00000007A690 Total Erase Count

-- IDENTIFY_DEVICE ---------------------------------------------------------
        0    1    2    3    4    5    6    7    8    9
000: 0040 3FFF C837 0010 0000 0000 003F 0000 0000 0000
010: 3530 3032 3642 3736 3833 3434 4237 4135 2020 2020
020: 0000 0000 0000 5342 464B 4B31 4233 4B49 4E47 5354
030: 4F4E 2053 4134 3030 5333 3739 3630 4720 2020 2020
040: 2020 2020 2020 2020 2020 2020 2020 8001 4000 2F00
050: 4000 0000 0000 0007 3FFF 0010 003F FC10 00FB 0101
060: FFFF 0FFF 0000 0007 0003 0078 0078 0078 0078 0C00
070: 0000 0000 0000 0000 0000 001F 850E 0006 004C 0040
080: 07F8 011B 746B 7409 4160 7469 B401 4160 207F 000A
090: 001E 0000 FFFE 0000 0000 0000 0000 0000 0000 0000
100: 1AB0 6FC8 0000 0000 0000 0008 4000 0000 5002 6B76
110: 8344 B7A5 0000 0000 0000 0000 0000 0000 0000 401C
120: 401C 0000 0000 0000 0000 0000 0000 0000 0029 0000
130: 0000 0000 0000 0000 0000 0000 0000 0000 0000 0000
140: 0000 0000 0000 0000 0000 0000 0000 0000 0000 0000
150: 0000 0000 0000 0000 0000 0000 0000 0000 0000 0000
160: 0000 0000 0000 0000 0000 0000 0000 0000 0000 0001
170: 0000 0000 0000 0000 0000 0000 0000 0000 0000 0000
180: 0000 0000 0000 0000 0000 0000 0000 0000 0000 0000
190: 0000 0000 0000 0000 0000 0000 0000 0000 0000 0000
200: 0000 0000 0000 0000 0000 0000 0000 0000 0000 4000
210: 0000 0000 0000 0000 0000 0000 0000 0001 0000 0000
220: 0000 0000 10FF 0000 0000 0000 0000 0000 0000 0000
230: 0000 0000 0000 0000 0001 0400 0000 0000 0000 0000
240: 0000 0000 0000 0000 0000 0000 0000 0000 0000 0000
250: 0000 0000 0000 0000 0000 DAA5

-- SMART_READ_DATA ---------------------------------------------------------
     +0 +1 +2 +3 +4 +5 +6 +7 +8 +9 +A +B +C +D +E +F
000: 10 00 01 32 00 64 64 00 00 00 00 00 00 00 09 32
010: 00 64 64 ED 6F 00 00 00 00 00 0C 32 00 64 64 AF
020: 01 00 00 00 00 00 94 00 00 64 64 00 00 00 00 00
030: 00 00 95 00 00 64 64 00 00 00 00 00 00 00 A7 00
040: 00 64 64 00 00 00 00 00 00 00 A8 12 00 64 64 00
050: 00 00 00 00 00 00 A9 00 00 64 64 05 00 00 00 00
060: 00 00 AA 00 00 64 64 0B 00 00 00 00 00 00 AC 32
070: 00 64 64 00 00 00 00 00 00 00 AD 00 00 64 64 2A
080: 00 16 00 00 00 00 B5 32 00 64 64 00 00 00 00 00
090: 00 00 B6 00 00 64 64 00 00 00 00 00 00 00 BB 32
0A0: 00 64 64 00 00 00 00 00 00 00 C0 12 00 64 64 30
0B0: 00 00 00 00 00 00 C2 22 00 18 35 18 00 35 00 0C
0C0: 00 00 C4 32 00 64 64 00 00 00 00 00 00 00 C7 32
0D0: 00 64 64 00 00 00 00 00 00 00 DA 32 00 64 64 00
0E0: 00 00 00 00 00 00 E7 00 00 61 61 61 00 00 00 00
0F0: 00 00 E9 32 00 64 64 04 2E 00 00 00 00 00 F1 32
100: 00 64 64 D9 32 00 00 00 00 00 F2 32 00 64 64 FF
110: 32 00 00 00 00 00 F4 00 00 64 64 16 00 00 00 00
120: 00 00 F5 00 00 64 64 2A 00 00 00 00 00 00 F6 00
130: 00 64 64 90 A6 07 00 00 00 00 00 00 00 00 00 00
140: 00 00 00 00 00 00 00 00 00 00 00 00 00 00 00 00
150: 00 00 00 00 00 00 00 00 00 00 00 00 00 00 00 00
160: 00 00 00 00 00 00 00 00 00 00 00 00 FF FF 00 00
170: 03 00 01 00 02 1E 06 1E 00 00 00 00 00 00 00 00
180: 00 00 00 00 00 00 00 00 00 00 00 00 00 00 00 00
190: 00 00 00 00 00 00 00 00 00 00 00 00 00 00 00 00
1A0: 00 00 00 00 00 00 00 00 00 00 00 00 00 00 00 00
1B0: 00 00 00 00 00 00 00 00 00 00 00 00 00 00 00 00
1C0: 00 00 00 00 00 00 00 00 00 00 00 00 00 00 00 00
1D0: 00 00 00 00 00 00 00 00 00 00 00 00 00 00 00 00
1E0: 00 00 00 00 00 00 00 00 00 00 00 00 00 00 00 00
1F0: 00 00 00 00 00 00 00 00 00 00 00 00 00 00 00 33

-- SMART_READ_THRESHOLD ----------------------------------------------------
     +0 +1 +2 +3 +4 +5 +6 +7 +8 +9 +A +B +C +D +E +F
000: 10 00 01 00 00 00 00 00 00 00 00 00 00 00 09 00
010: 00 00 00 00 00 00 00 00 00 00 0C 00 00 00 00 00
020: 00 00 00 00 00 00 94 00 00 00 00 00 00 00 00 00
030: 00 00 95 00 00 00 00 00 00 00 00 00 00 00 A7 00
040: 00 00 00 00 00 00 00 00 00 00 A8 00 00 00 00 00
050: 00 00 00 00 00 00 A9 00 00 00 00 00 00 00 00 00
060: 00 00 AA 0A 00 00 00 00 00 00 00 00 00 00 AC 00
070: 00 00 00 00 00 00 00 00 00 00 AD 00 00 00 00 00
080: 00 00 00 00 00 00 B5 00 00 00 00 00 00 00 00 00
090: 00 00 B6 00 00 00 00 00 00 00 00 00 00 00 BB 00
0A0: 00 00 00 00 00 00 00 00 00 00 C0 00 00 00 00 00
0B0: 00 00 00 00 00 00 C2 00 00 00 00 00 00 00 00 00
0C0: 00 00 C4 00 00 00 00 00 00 00 00 00 00 00 C7 00
0D0: 00 00 00 00 00 00 00 00 00 00 DA 00 00 00 00 00
0E0: 00 00 00 00 00 00 E7 00 00 00 00 00 00 00 00 00
0F0: 00 00 E9 00 00 00 00 00 00 00 00 00 00 00 F1 00
100: 00 00 00 00 00 00 00 00 00 00 F2 00 00 00 00 00
110: 00 00 00 00 00 00 F4 00 00 00 00 00 00 00 00 00
120: 00 00 F5 00 00 00 00 00 00 00 00 00 00 00 F6 00
130: 00 00 00 00 00 00 00 00 00 00 00 00 00 00 00 00
140: 00 00 00 00 00 00 00 00 00 00 00 00 00 00 00 00
150: 00 00 00 00 00 00 00 00 00 00 00 00 00 00 00 00
160: 00 00 00 00 00 00 00 00 00 00 00 00 00 00 00 00
170: 00 00 00 00 00 00 00 00 00 00 00 00 00 00 00 00
180: 00 00 00 00 00 00 00 00 00 00 00 00 00 00 00 00
190: 00 00 00 00 00 00 00 00 00 00 00 00 00 00 00 00
1A0: 00 00 00 00 00 00 00 00 00 00 00 00 00 00 00 00
1B0: 00 00 00 00 00 00 00 00 00 00 00 00 00 00 00 00
1C0: 00 00 00 00 00 00 00 00 00 00 00 00 00 00 00 00
1D0: 00 00 00 00 00 00 00 00 00 00 00 00 00 00 00 00
1E0: 00 00 00 00 00 00 00 00 00 00 00 00 00 00 00 00
1F0: 00 00 00 00 00 00 00 00 00 00 00 00 00 00 00 0D

----------------------------------------------------------------------------
 (03) ST4000DX001-1CE168
----------------------------------------------------------------------------
           Model : ST4000DX001-1CE168
        Firmware : CC44
   Serial Number : Z302HCFJ
       Disk Size : 4000.7 GB (8.4/137.4/4000.7/4000.7)
     Buffer Size : Unknown
     Queue Depth : 32
    # of Sectors : 7814037168
   Rotation Rate : 5900 RPM
       Interface : Serial ATA
   Major Version : ACS-2
   Minor Version : ACS-3 Revision 3b
   Transfer Mode : SATA/600 | SATA/600
  Power On Hours : 58150 hours
  Power On Count : 3172 count
     Temperature : 27 C (80 F)
   Health Status : Good
        Features : S.M.A.R.T., APM, NCQ
       APM Level : 8080h [ON]
       AAM Level : ----
    Drive Letter : D:

-- S.M.A.R.T. --------------------------------------------------------------
ID Cur Wor Thr RawValues(6) Attribute Name
01 117 _99 __6 000009DB8BA8 Read Error Rate
03 _92 _91 __0 000000000000 Spin-Up Time
04 _96 _96 _20 00000000103A Start/Stop Count
05 100 100 _10 000000000000 Reallocated Sectors Count
07 _90 _60 _30 0001397312A9 Seek Error Rate
09 _34 _34 __0 00000000E326 Power-On Hours
0A 100 100 _97 000000000000 Spin Retry Count
0C _97 _97 _20 000000000C64 Power Cycle Count
B7 _99 _99 __0 000000000001 Vendor Specific
B8 100 100 _99 000000000000 End-to-End Error
BB 100 100 __0 000000000000 Reported Uncorrectable Errors
BC 100 _99 __0 000500540059 Command Timeout
BD 100 100 __0 000000000000 High Fly Writes
BE _73 _47 _45 00001B12001B Airflow Temperature
BF 100 100 __0 000000000000 G-Sense Error Rate
C0 100 100 __0 00000000044B Power-off Retract Count
C1 _94 _94 __0 000000003660 Load/Unload Cycle Count
C2 _27 _53 __0 000C0000001B Temperature
C5 100 100 __0 000000000000 Current Pending Sector Count
C6 100 100 __0 000000000000 Uncorrectable Sector Count
C7 200 199 __0 000000000002 UltraDMA CRC Error Count
F0 100 253 __0 18B00000E442 Head Flying Hours
F1 100 253 __0 00430880508E Total Host Writes
F2 100 253 __0 00484C558765 Total Host Reads

-- IDENTIFY_DEVICE ---------------------------------------------------------
        0    1    2    3    4    5    6    7    8    9
000: 0C5A 3FFF C837 0010 0000 0000 003F 0000 0000 0000
010: 2020 2020 2020 2020 2020 2020 5A33 3032 4843 464A
020: 0000 0000 0004 4343 3434 2020 2020 5354 3430 3030
030: 4458 3030 312D 3143 4531 3638 2020 2020 2020 2020
040: 2020 2020 2020 2020 2020 2020 2020 8010 4000 2F00
050: 4000 0200 0200 0007 3FFF 0010 003F FC10 00FB 0110
060: FFFF 0FFF 0000 0007 0003 0078 0078 0078 0078 0000
070: 0000 0000 0000 0000 0000 001F 850E 0006 004C 0040
080: 03F0 001F 346B 7D09 4163 3469 BC09 4163 207F 00F4
090: 00F4 8080 FFFE 0000 D0D0 0000 0000 0000 0000 0000
100: BEB0 D1C0 0001 0000 0000 0000 6003 0000 5000 C500
110: 798F 5F18 0000 0000 0000 0000 0000 0000 0000 401E
120: 401C 0000 0000 0000 0000 0000 0000 0000 0029 BEB0
130: D1C0 BEB0 D1C0 2020 0002 0140 0100 5000 3C06 3C0A
140: 0000 003C 0000 0008 0000 0000 05FF 0280 0000 0000
150: 0008 0000 0000 0000 0000 0001 0000 0000 7000 8006
160: 0000 0000 0000 0000 0000 0000 0000 0000 0002 0000
170: 0000 0000 0000 0000 0000 0000 0000 0000 0000 0000
180: 0000 0000 0000 0000 0000 0000 0000 0000 0000 0000
190: 0000 0000 0000 0000 0000 0000 0000 0000 0000 0000
200: 0000 0000 0000 0000 0000 0000 1081 0000 0000 4000
210: 0000 0000 0000 0000 0000 0000 0000 170C 0000 0000
220: 0000 0000 107E 0000 0000 0000 0000 0000 0000 0000
230: 0000 0000 0000 0000 0000 0000 0000 0000 0000 0000
240: 0000 0000 0000 0003 0000 0000 0000 0000 0000 0000
250: 0000 0000 0000 0000 0000 DEA5

-- SMART_READ_DATA ---------------------------------------------------------
     +0 +1 +2 +3 +4 +5 +6 +7 +8 +9 +A +B +C +D +E +F
000: 0A 00 01 0F 00 75 63 A8 8B DB 09 00 00 00 03 03
010: 00 5C 5B 00 00 00 00 00 00 00 04 32 00 60 60 3A
020: 10 00 00 00 00 00 05 33 00 64 64 00 00 00 00 00
030: 00 00 07 0F 00 5A 3C A9 12 73 39 01 00 00 09 32
040: 00 22 22 26 E3 00 00 00 00 00 0A 13 00 64 64 00
050: 00 00 00 00 00 00 0C 32 00 61 61 64 0C 00 00 00
060: 00 00 B7 32 00 63 63 01 00 00 00 00 00 00 B8 32
070: 00 64 64 00 00 00 00 00 00 00 BB 32 00 64 64 00
080: 00 00 00 00 00 00 BC 32 00 64 63 59 00 54 00 05
090: 00 00 BD 3A 00 64 64 00 00 00 00 00 00 00 BE 22
0A0: 00 49 2F 1B 00 12 1B 00 00 00 BF 32 00 64 64 00
0B0: 00 00 00 00 00 00 C0 32 00 64 64 4B 04 00 00 00
0C0: 00 00 C1 32 00 5E 5E 60 36 00 00 00 00 00 C2 22
0D0: 00 1B 35 1B 00 00 00 0C 00 00 C5 12 00 64 64 00
0E0: 00 00 00 00 00 00 C6 10 00 64 64 00 00 00 00 00
0F0: 00 00 C7 3E 00 C8 C7 02 00 00 00 00 00 00 F0 00
100: 00 64 FD 42 E4 00 00 B0 18 28 F1 00 00 64 FD 8E
110: 50 80 08 43 00 00 F2 00 00 64 FD 65 87 55 4C 48
120: 00 00 00 00 00 00 00 00 00 00 00 00 00 00 00 00
130: 00 00 00 00 00 00 00 00 00 00 00 00 00 00 00 00
140: 00 00 00 00 00 00 00 00 00 00 00 00 00 00 00 00
150: 00 00 00 00 00 00 00 00 00 00 00 00 00 00 00 00
160: 00 00 00 00 00 00 00 00 00 00 00 00 61 00 00 73
170: 03 00 01 00 01 FF 02 FB 01 00 00 00 00 00 00 00
180: 00 00 00 00 00 00 00 00 01 08 08 08 08 08 08 08
190: 08 00 00 00 00 00 00 00 00 01 00 00 00 00 00 00
1A0: 00 00 00 00 00 00 00 00 67 23 1B 8B 65 BE 00 00
1B0: 00 00 00 00 01 00 FF FF 8E 50 80 08 43 00 00 00
1C0: 65 87 55 4C 48 00 00 00 00 00 00 00 00 00 00 00
1D0: 00 00 00 00 00 00 00 00 E7 04 00 00 01 00 00 00
1E0: 00 00 00 00 10 18 00 00 00 00 00 00 00 00 00 01
1F0: 00 00 00 00 00 00 00 00 00 00 14 18 00 00 00 44

-- SMART_READ_THRESHOLD ----------------------------------------------------
     +0 +1 +2 +3 +4 +5 +6 +7 +8 +9 +A +B +C +D +E +F
000: 01 00 01 06 00 00 00 00 00 00 00 00 00 00 03 00
010: 00 00 00 00 00 00 00 00 00 00 04 14 00 00 00 00
020: 00 00 00 00 00 00 05 0A 00 00 00 00 00 00 00 00
030: 00 00 07 1E 00 00 00 00 00 00 00 00 00 00 09 00
040: 00 00 00 00 00 00 00 00 00 00 0A 61 00 00 00 00
050: 00 00 00 00 00 00 0C 14 00 00 00 00 00 00 00 00
060: 00 00 B7 00 00 00 00 00 00 00 00 00 00 00 B8 63
070: 00 00 00 00 00 00 00 00 00 00 BB 00 00 00 00 00
080: 00 00 00 00 00 00 BC 00 00 00 00 00 00 00 00 00
090: 00 00 BD 00 00 00 00 00 00 00 00 00 00 00 BE 2D
0A0: 00 00 00 00 00 00 00 00 00 00 BF 00 00 00 00 00
0B0: 00 00 00 00 00 00 C0 00 00 00 00 00 00 00 00 00
0C0: 00 00 C1 00 00 00 00 00 00 00 00 00 00 00 C2 00
0D0: 00 00 00 00 00 00 00 00 00 00 C5 00 00 00 00 00
0E0: 00 00 00 00 00 00 C6 00 00 00 00 00 00 00 00 00
0F0: 00 00 C7 00 00 00 00 00 00 00 00 00 00 00 F0 00
100: 00 00 00 00 00 00 00 00 00 00 F1 00 00 00 00 00
110: 00 00 00 00 00 00 F2 00 00 00 00 00 00 00 00 00
120: 00 00 00 00 00 00 00 00 00 00 00 00 00 00 00 00
130: 00 00 00 00 00 00 00 00 00 00 00 00 00 00 00 00
140: 00 00 00 00 00 00 00 00 00 00 00 00 00 00 00 00
150: 00 00 00 00 00 00 00 00 00 00 00 00 00 00 00 00
160: 00 00 00 00 00 00 00 00 00 00 00 00 00 00 00 00
170: 00 00 00 00 00 00 00 00 00 00 00 00 00 00 00 00
180: 00 00 00 00 00 00 00 00 00 00 00 00 00 00 00 00
190: 00 00 00 00 00 00 00 00 00 00 00 00 00 00 00 00
1A0: 00 00 00 00 00 00 00 00 00 00 00 00 00 00 00 00
1B0: 00 00 00 00 00 00 00 00 00 00 00 00 00 00 00 00
1C0: 00 00 00 00 00 00 00 00 00 00 00 00 00 00 00 00
1D0: 00 00 00 00 00 00 00 00 00 00 00 00 00 00 00 00
1E0: 00 00 00 00 00 00 00 00 00 00 00 00 00 00 00 00
1F0: 00 00 00 00 00 00 00 00 00 00 00 00 00 00 00 FD

----------------------------------------------------------------------------
 (04) Samsung SSD 860 EVO 500GB
----------------------------------------------------------------------------
           Model : Samsung SSD 860 EVO 500GB
        Firmware : RVT03B6Q
   Serial Number : S3Z1NY0M611928M
       Disk Size : 500.1 GB (8.4/137.4/500.1/500.1)
     Buffer Size : Unknown
     Queue Depth : 32
    # of Sectors : 976773168
   Rotation Rate : ---- (SSD)
       Interface : Serial ATA
   Major Version : ACS-4
   Minor Version : ACS-4 Revision 5
   Transfer Mode : SATA/600 | SATA/600
  Power On Hours : 31793 hours
  Power On Count : 448 count
     Host Writes : 178981 GB
Wear Level Count : 494
     Temperature : 34 C (93 F)
   Health Status : Good (67 %)
        Features : S.M.A.R.T., NCQ, TRIM, DevSleep
       APM Level : ----
       AAM Level : ----
    Drive Letter : C:

-- S.M.A.R.T. --------------------------------------------------------------
ID Cur Wor Thr RawValues(6) Attribute Name
05 100 100 _10 000000000000 Reallocated Sector Count
09 _93 _93 __0 000000007C31 Power-on Hours
0C _99 _99 __0 0000000001C0 Power-on Count
B1 _67 _67 __0 0000000001EE Wear Leveling Count
B3 100 100 _10 000000000000 Used Reserved Block Count (Total)
B5 100 100 _10 000000000000 Program Fail Count (Total)
B6 100 100 _10 000000000000 Erase Fail Count (Total)
B7 100 100 _10 000000000000 Runtime Bad Block (Total)
BB 100 100 __0 000000000000 Uncorrectable Error Count
BE _66 _41 __0 000000000022 Airflow Temperature
C3 200 200 __0 000000000000 ECC Error Rate
C7 100 100 __0 000000000000 CRC Error Count
EB _99 _99 __0 000000000030 POR Recovery Count
F1 _99 _99 __0 005764B6ED88 Total LBAs Written

-- IDENTIFY_DEVICE ---------------------------------------------------------
        0    1    2    3    4    5    6    7    8    9
000: 0040 3FFF C837 0010 0000 0000 003F 0000 0000 0000
010: 5333 5A31 4E59 304D 3631 3139 3238 4D20 2020 2020
020: 0000 0000 0000 5256 5430 3342 3651 5361 6D73 756E
030: 6720 5353 4420 3836 3020 4556 4F20 3530 3047 4220
040: 2020 2020 2020 2020 2020 2020 2020 8001 4001 2F00
050: 4000 0200 0200 0007 3FFF 0010 003F FC10 00FB 0101
060: FFFF 0FFF 0000 0007 0003 0078 0078 0078 0078 4F30
070: 0000 0000 0000 0000 0000 001F 850E 00C6 016C 0060
080: 09FC 005E 746B 7D01 4163 7469 BC01 4163 207F 0002
090: 0004 0000 FFFE 0000 0000 0000 0000 0000 0000 0000
100: 6030 3A38 0000 0000 0000 0008 4000 0000 5002 538E
110: 0960 1A38 0000 0000 0000 0000 0000 0000 0000 401E
120: 401C 0000 0000 0000 0000 0000 0000 0000 0029 0000
130: 0000 0000 0000 0000 0000 0000 0000 0000 0000 0000
140: 0000 0000 0000 0000 0000 0000 0000 0000 0000 0000
150: 0000 0000 0000 0000 0000 0000 0000 0000 0000 0000
160: 0000 0000 0000 0000 0000 0000 0000 0000 0003 0001
170: 2020 2020 2020 2020 0000 0000 0000 0000 0000 0000
180: 0000 0000 0000 0000 0000 0000 0000 0000 0000 0000
190: 0000 0000 0000 0000 0000 0000 0000 0000 0000 0000
200: 0000 0000 0000 0000 0000 0000 003D 0000 0000 4000
210: 0000 0000 0000 0000 0000 0000 0000 0001 0000 0000
220: 0000 0000 10FF 0000 0000 0000 0000 0000 0000 0000
230: 0000 0000 0000 0000 0000 0800 0000 0000 0000 0000
240: 0000 0000 0000 4000 0000 0000 0000 0000 0000 0000
250: 0000 0000 0000 0000 0000 78A5

-- SMART_READ_DATA ---------------------------------------------------------
     +0 +1 +2 +3 +4 +5 +6 +7 +8 +9 +A +B +C +D +E +F
000: 01 00 05 33 00 64 64 00 00 00 00 00 00 00 09 32
010: 00 5D 5D 31 7C 00 00 00 00 00 0C 32 00 63 63 C0
020: 01 00 00 00 00 00 B1 13 00 43 43 EE 01 00 00 00
030: 00 00 B3 13 00 64 64 00 00 00 00 00 00 00 B5 32
040: 00 64 64 00 00 00 00 00 00 00 B6 32 00 64 64 00
050: 00 00 00 00 00 00 B7 13 00 64 64 00 00 00 00 00
060: 00 00 BB 32 00 64 64 00 00 00 00 00 00 00 BE 32
070: 00 42 29 22 00 00 00 00 00 00 C3 1A 00 C8 C8 00
080: 00 00 00 00 00 00 C7 3E 00 64 64 00 00 00 00 00
090: 00 00 EB 12 00 63 63 30 00 00 00 00 00 00 F1 32
0A0: 00 63 63 88 ED B6 64 57 00 00 00 00 00 00 00 00
0B0: 00 00 00 00 00 00 00 00 00 00 00 00 00 00 00 00
0C0: 00 00 00 00 00 00 00 00 00 00 00 00 00 00 00 00
0D0: 00 00 00 00 00 00 00 00 00 00 00 00 00 00 00 00
0E0: 00 00 00 00 00 00 00 00 00 00 00 00 00 00 00 00
0F0: 00 00 00 00 00 00 00 00 00 00 00 00 00 00 00 00
100: 00 00 00 00 00 00 00 00 00 00 00 00 00 00 00 00
110: 00 00 00 00 00 00 00 00 00 00 00 00 00 00 00 00
120: 00 00 00 00 00 00 00 00 00 00 00 00 00 00 00 00
130: 00 00 00 00 00 00 00 00 00 00 00 00 00 00 00 00
140: 00 00 00 00 00 00 00 00 00 00 00 00 00 00 00 00
150: 00 00 00 00 00 00 00 00 00 00 00 00 00 00 00 00
160: 00 00 00 00 00 00 00 00 00 00 00 00 00 00 00 53
170: 03 00 01 00 02 55 00 00 00 00 00 00 00 00 00 00
180: 00 00 00 00 00 00 00 00 00 00 00 00 00 00 00 00
190: 00 00 00 00 00 00 00 00 00 00 00 00 00 00 00 00
1A0: 00 00 00 00 00 00 00 00 00 00 00 00 00 00 00 00
1B0: 00 00 00 00 00 00 00 00 00 00 00 00 00 00 00 00
1C0: 00 00 00 00 00 00 00 00 00 00 00 00 00 00 00 00
1D0: 00 00 00 00 00 00 00 00 00 00 00 00 00 00 00 00
1E0: 00 00 00 00 00 00 00 00 00 00 00 00 00 00 00 00
1F0: 00 00 00 00 00 00 00 00 00 00 00 00 00 00 00 04

-- SMART_READ_THRESHOLD ----------------------------------------------------
     +0 +1 +2 +3 +4 +5 +6 +7 +8 +9 +A +B +C +D +E +F
000: 01 00 05 0A 00 00 00 00 00 00 00 00 00 00 09 00
010: 00 00 00 00 00 00 00 00 00 00 0C 00 00 00 00 00
020: 00 00 00 00 00 00 B1 00 00 00 00 00 00 00 00 00
030: 00 00 B3 0A 00 00 00 00 00 00 00 00 00 00 B5 0A
040: 00 00 00 00 00 00 00 00 00 00 B6 0A 00 00 00 00
050: 00 00 00 00 00 00 B7 0A 00 00 00 00 00 00 00 00
060: 00 00 BB 00 00 00 00 00 00 00 00 00 00 00 BE 00
070: 00 00 00 00 00 00 00 00 00 00 C3 00 00 00 00 00
080: 00 00 00 00 00 00 C7 00 00 00 00 00 00 00 00 00
090: 00 00 EB 00 00 00 00 00 00 00 00 00 00 00 F1 00
0A0: 00 00 00 00 00 00 00 00 00 00 00 00 00 00 00 00
0B0: 00 00 00 00 00 00 00 00 00 00 00 00 00 00 00 00
0C0: 00 00 00 00 00 00 00 00 00 00 00 00 00 00 00 00
0D0: 00 00 00 00 00 00 00 00 00 00 00 00 00 00 00 00
0E0: 00 00 00 00 00 00 00 00 00 00 00 00 00 00 00 00
0F0: 00 00 00 00 00 00 00 00 00 00 00 00 00 00 00 00
100: 00 00 00 00 00 00 00 00 00 00 00 00 00 00 00 00
110: 00 00 00 00 00 00 00 00 00 00 00 00 00 00 00 00
120: 00 00 00 00 00 00 00 00 00 00 00 00 00 00 00 00
130: 00 00 00 00 00 00 00 00 00 00 00 00 00 00 00 00
140: 00 00 00 00 00 00 00 00 00 00 00 00 00 00 00 00
150: 00 00 00 00 00 00 00 00 00 00 00 00 00 00 00 00
160: 00 00 00 00 00 00 00 00 00 00 00 00 00 00 00 00
170: 00 00 00 00 00 00 00 00 00 00 00 00 00 00 00 00
180: 00 00 00 00 00 00 00 00 00 00 00 00 00 00 00 00
190: 00 00 00 00 00 00 00 00 00 00 00 00 00 00 00 00
1A0: 00 00 00 00 00 00 00 00 00 00 00 00 00 00 00 00
1B0: 00 00 00 00 00 00 00 00 00 00 00 00 00 00 00 00
1C0: 00 00 00 00 00 00 00 00 00 00 00 00 00 00 00 00
1D0: 00 00 00 00 00 00 00 00 00 00 00 00 00 00 00 00
1E0: 00 00 00 00 00 00 00 00 00 00 00 00 00 00 00 00
1F0: 00 00 00 00 00 00 00 00 00 00 00 00 00 00 00 4E

----------------------------------------------------------------------------
 (05) Samsung SSD 980 1TB
----------------------------------------------------------------------------
           Model : Samsung SSD 980 1TB
        Firmware : 1B4QFXO7
   Serial Number : S64ANG0R208507L
       Disk Size : 1000.2 GB
       Interface : NVM Express
        Standard : NVM Express 1.4
   Transfer Mode : PCIe 3.0 x2 | PCIe 3.0 x4
  Power On Hours : 16440 hours
  Power On Count : 665 count
      Host Reads : 13391 GB
     Host Writes : 10512 GB
     Temperature : 37 C (98 F)
   Health Status : Good (99 %)
        Features : S.M.A.R.T., TRIM, VolatileWriteCache
    Drive Letter : G:

-- S.M.A.R.T. --------------------------------------------------------------
ID RawValues(6) Attribute Name
01 000000000000 Critical Warning
02 000000000135 Composite Temperature
03 000000000064 Available Spare
04 00000000000A Available Spare Threshold
05 000000000001 Percentage Used
06 000001AC83B0 Data Units Read
07 000001506257 Data Units Written
08 00000366DE01 Host Read Commands
09 00000335ED59 Host Write Commands
0A 0000000001F5 Controller Busy Time
0B 000000000299 Power Cycles
0C 000000004037 Power On Hours
0D 000000000156 Unsafe Shutdowns
0E 000000000000 Media and Data Integrity Errors
0F 000000000000 Number of Error Information Log Entries

-- IDENTIFY_DEVICE ---------------------------------------------------------
        0    1    2    3    4    5    6    7    8    9
000: 144D 144D 3653 4134 474E 5230 3032 3538 3730 204C
010: 2020 2020 6153 736D 6E75 2067 5353 2044 3839 2030
020: 5431 2042 2020 2020 2020 2020 2020 2020 2020 2020
030: 2020 2020 4231 5134 5846 374F 3802 0025 0900 0005
040: 0400 0001 A120 0007 1200 007A 0200 0000 0010 0000
050: 0000 0000 0000 0000 0000 0100 0000 0000 0000 0000
060: 0000 0000 0000 0000 0000 0000 0000 0000 0000 0000
070: 0000 0000 0000 0000 0000 0000 0000 0000 0000 0000
080: 0000 0000 0000 0000 0000 0000 0000 0000 0000 0000
090: 0000 0000 0000 0000 0000 0000 0000 0000 0000 0000
100: 0000 0000 0000 0000 0000 0000 0000 0000 0000 0000
110: 0000 0000 0000 0000 0000 0000 0000 0000 0000 0000
120: 0000 0000 0000 0000 0000 0000 0000 0000 0017 0307
130: 0F16 043F 0101 0163 0166 0000 4000 0000 1000 0000
140: 6000 E0DB 00E8 0000 0000 0000 0000 0000 0000 0000
150: 0000 0000 0000 0000 0000 0000 0000 0000 0023 0400
160: 0000 0001 013E 0165 0003 6000 0010 0000 0400 0000
170: 0001 0000 0000 0000 0000 0000 0000 0000 0000 0000
180: 0000 0000 0000 0000 0000 0000 0000 0000 0000 0000
190: 0000 0000 0000 0000 0000 0000 0000 0000 0000 0000
200: 0000 0000 0000 0000 0000 0000 0000 0000 0000 0000
210: 0000 0000 0000 0000 0000 0000 0000 0000 0000 0000
220: 0000 0000 0000 0000 0000 0000 0000 0000 0000 0000
230: 0000 0000 0000 0000 0000 0000 0000 0000 0000 0000
240: 0000 0000 0000 0000 0000 0000 0000 0000 0000 0000
250: 0000 0000 0000 0000 0000 0000

-- SMART_NVME --------------------------------------------------------------
     +0 +1 +2 +3 +4 +5 +6 +7 +8 +9 +A +B +C +D +E +F
000: 00 36 01 64 0A 01 00 00 00 00 00 00 00 00 00 00
010: 00 00 00 00 00 00 00 00 00 00 00 00 00 00 00 00
020: B0 83 AC 01 00 00 00 00 00 00 00 00 00 00 00 00
030: 57 62 50 01 00 00 00 00 00 00 00 00 00 00 00 00
040: 01 DE 66 03 00 00 00 00 00 00 00 00 00 00 00 00
050: 59 ED 35 03 00 00 00 00 00 00 00 00 00 00 00 00
060: F5 01 00 00 00 00 00 00 00 00 00 00 00 00 00 00
070: 99 02 00 00 00 00 00 00 00 00 00 00 00 00 00 00
080: 38 40 00 00 00 00 00 00 00 00 00 00 00 00 00 00
090: 56 01 00 00 00 00 00 00 00 00 00 00 00 00 00 00
0A0: 00 00 00 00 00 00 00 00 00 00 00 00 00 00 00 00
0B0: 00 00 00 00 00 00 00 00 00 00 00 00 00 00 00 00
0C0: 00 00 00 00 00 00 00 00 36 01 3C 01 00 00 00 00
0D0: 00 00 00 00 00 00 00 00 00 00 00 00 00 00 00 00
0E0: 00 00 00 00 00 00 00 00 00 00 00 00 00 00 00 00
0F0: 00 00 00 00 00 00 00 00 00 00 00 00 00 00 00 00
100: 00 00 00 00 00 00 00 00 00 00 00 00 00 00 00 00
110: 00 00 00 00 00 00 00 00 00 00 00 00 00 00 00 00
120: 00 00 00 00 00 00 00 00 00 00 00 00 00 00 00 00
130: 00 00 00 00 00 00 00 00 00 00 00 00 00 00 00 00
140: 00 00 00 00 00 00 00 00 00 00 00 00 00 00 00 00
150: 00 00 00 00 00 00 00 00 00 00 00 00 00 00 00 00
160: 00 00 00 00 00 00 00 00 00 00 00 00 00 00 00 00
170: 00 00 00 00 00 00 00 00 00 00 00 00 00 00 00 00
180: 00 00 00 00 00 00 00 00 00 00 00 00 00 00 00 00
190: 00 00 00 00 00 00 00 00 00 00 00 00 00 00 00 00
1A0: 00 00 00 00 00 00 00 00 00 00 00 00 00 00 00 00
1B0: 00 00 00 00 00 00 00 00 00 00 00 00 00 00 00 00
1C0: 00 00 00 00 00 00 00 00 00 00 00 00 00 00 00 00
1D0: 00 00 00 00 00 00 00 00 00 00 00 00 00 00 00 00
1E0: 00 00 00 00 00 00 00 00 00 00 00 00 00 00 00 00
1F0: 00 00 00 00 00 00 00 00 00 00 00 00 00 00 00 00

